Title,Romanised Title,A.K.A,Publisher(s),Year Release,Region,Decision,Platform,Rating,Consumer Advice,Decision Date,More Info
DRAGON'S DOGMA: DARK ARISEN,DRAGON'S DOGMA: DARK ARISEN,,CAPCOM,2013,ASIA,Approved,"Sony Playstation 3,Xbox 360",Mature 18,"VIOLENCE, NUDITY AND SEXUAL REFERENCES",19/04/2013,"‘Dragon’s Dogma: Dark Arisen’ is a role-playing game and a re-release of ‘Dragon’s Dogma’, consisting of the original base game with additional content. The main character known as the Arisen and his companions are on a quest to destroy a mysterious great dragon that has once again awakened to destroy the world. Gameplay consists of undertaking and completing various quests to earn rewards, experience, and level up. The Arisen can recruit companions called Pawns throughout the game, who will aid and advise the player in combat and on quests. Weapons like swords, axes, bows, and magical staffs are used to battle human enemies such as bandits and rogues, and mostly fantasy creatures such as ogres, harpies, and goblins. Blood splattering occurs frequently when characters are attacked, and may leave blood stains on the ground. A scene shows a character’s heart being extracted out and devoured by a dragon. The player will frequently encounter Harpies and Succubi, which are winged female monsters with topless upper torsos. Depending on the gender of the main character, some scenes of intimacy may depict characters of the same sex embracing and kissing."
神次元アイドル ネプテューヌ PP,KAMI JIGEN IDOL NEPTUNE PP,HYPERDIMENSION IDOL NEPTUNIA PP/GOD DIMENSION IDOL NEPTUNIA,IDEA FACTORY CO LTD,2013,ASIA,Approved,Sony PS Vita,Age Advisory,,17/06/2013,"‘神次元アイドル ネプテューヌ PP’ [Romanised title: Kami Jigen Idol Neptune PP] is a simulation game in which the player takes on the role of a music producer who must ensure the successful launch of the music careers of various female characters who are put under his charge. This game is classified with the Age Advisory rating and is ‘Suitable for 16 & Above’. During game play, the player may come across scenes that depict scantily-clad female characters who are dressed in clothing that reveal the cleavage and parts of the breasts. While details such as the nipples are not depicted, these scenes of partial nudity are suggestive and unsuitable for viewing by the young. According to the Age Advisory guidelines, “Still or moving images which are mildly suggestive (e.g. scantily-clad women in bikinis or lingerie) may be featured”."
BORDERLANDS 2: BONUS CONTENT PACK,BORDERLANDS 2: BONUS CONTENT PACK,BORDERLANDS 2: ADD-ON CONTENT PACK,TAKE2/2K GAMES/GEARBOX,2013,ASIA,Approved,"PC,Sony Playstation 3,Xbox 360",Mature 18,VIOLENCE AND SEXUAL REFERENCES,06/02/2013,
DISGAEA D2,DISGAEA D2,DISGAEA DIMENSION 2,NIPPON ICHI SOFTWARE INC.,2013,"ASIA,JP",Approved,Sony Playstation 3,General,,06/02/2013,
DEAD ISLAND: RIPTIDE,DEAD ISLAND: RIPTIDE,,TECHLAND / DEEP SILVER,2013,ASIA,Approved,"PC,Sony Playstation 3,Xbox 360",Mature 18,STRONG VIOLENCE AND COARSE LANGUAGE,28/03/2013,"‘Dead Island: Riptide’ is an open world, action role-playing game in which the player takes on the role of one of the survivors who has managed to escape from the island Banoi, where a zombie infection had broken out. Despite the group’s successful escape from Banoi, their fate takes a turn for the worse as they find themselves held captive on a military ship. When a zombie outbreak overwhelms the ship’s crew, the survivors escape to another island, Palanai, where they relive their nightmare once again as the island, too, has been overrun by zombies. This game is classified M18 with the consumer advice “Strong Violence and Coarse Language”. During combat sequences against enemies, which include zombies and humans, realistic injuries such as dismemberments and decapitations will occur frequently. Explosive weapons can cause zombies to blow up into pieces, which are accompanied by blood effects such as blood splatters that stain the ground. Dismembered body parts and blood stains will remain visible until the player leaves the vicinity. Various means of transportation, such as speedboats and cars, can be driven into zombies, killing them instantly and creating blood splatters. Under the M18 guidelines “depictions of realistic violence such as killing, maiming or causing other serious injury to humanoid characters if it is not sadistic, cruel or abhorrent.” are allowed. Strong coarse language, such as the word ‘mother**ker’ is used frequently in the game’s dialogues. “Frequent use of strong coarse language, such as “mother**ker”, “c*nt”, and “c**ksucker”” is allowed under the guidelines for an M18 rating. Other coarse language, such as the word ‘f**k’ can also be heard during game play."
SPELLFORCE: COMPLETE COLLECTION,SPELLFORCE COMPLETE COLLECTION,,NORDIC GAMES,2012,EURO,Approved,PC,General,,28/03/2013,
MADDEN NFL 25,MADDEN NFL 25,,ELECTRONIC ARTS,2013,ASIA,Approved,"Sony Playstation 3,Sony Playstation 4,Xbox 360,Xbox One",General,,17/05/2013,
KILLER IS DEAD,KILLER IS DEAD,,SONY COMPUTER ENTERTAINMENT INC / XSEED GAMES,2013,ASIA,Approved,"Sony Playstation 3,Xbox 360",Mature 18,STRONG VIOLENCE AND SEXUAL REFERENCES,01/08/2013,"‘Killer Is Dead’ is an action game set in a futuristic era of extreme technological advancement, where travel to the moon and human body reconstruction is not uncommon. The main character Mondo Zappa is a newly-recruited executioner employed by a state agency, which takes requests to kill and behead criminals and villains all across the world. This game is rated M18 for strong violence and sexual references. The player has to undertake a variety of main missions, in addition to optional side missions. The main character engages enemies in melee combat using a katana and his cybernetic left arm that houses a firearm and other variable weapon attachments. Enemies consist mainly of Cyborgs, creatures as well as human characters. In optional ‘Gigolo Missions’, the player can attempt to enchant and seduce female characters with gifts, in return for intimacy and rewards such as weapons and items. The level of violence is strong and intense, with frequent depictions of dismemberment and decapitation during combat. Several cinematic scenes also depict strong violence where characters are dismembered or decapitated. The guidelines at M18 state that “realistic violence such as killing, maiming or causing serious injury to humanoid characters can be allowed if not sadistic, cruel and abhorrent”. Several female characters are depicted with voluptuous figures and in cleavage-revealing clothing. The optional ‘Gigolo Missions’ mini-games allow the player to peek at female characters’ sensitive body areas such as the cleavage and crotch. The player can obtain and use a pair of X-Ray vision glasses during the mini-games that reveal these females in their lingerie. Successful completion of these mini-games culminates in scenes of intimacy, but there is no actual sex and nudity depicted as the screen blanks out."
MLB 13: THE SHOW,MLB 13 THE SHOW,,SONY COMPUTER ENTERTAINMENT INC.,2013,ASIA,Approved,"Sony Playstation 3,Sony PS Vita",General,,06/02/2013,
BROOKTOWN HIGH,BROOKTOWN HIGH,,KONAMI,2007,US,Approved,Sony Playstation Portable (PSP),General,,30/07/2013,
LEGO MARVEL SUPER HEROES,LEGO MARVEL SUPER HEROES,LEGO MARVEL SUPER HEROES: UNIVERSE IN PERIL,WARNER BROS,2013,ASIA,Approved,"Nintendo DS,Nintendo 3DS,PC,Nintendo Wii U,Sony Playstation 3,Sony Playstation 4,Sony PS Vita,Xbox 360,Xbox One",General,,23/08/2013,
神様と運命革命のパラドクス,KAMISAMA TO UNMEI KAKUMEI NO PARADOX,,NIPPON ICHI SOFTWARE,2013,ASIA,Approved,Sony Playstation 3,General,,10/01/2013,
ALIENS: COLONIAL MARINES,ALIENS: COLONIAL MARINES,ALIENS: COLONIAL MARINES COLLECTOR'S EDITION/LIMITED EDITION,SEGA EUROPE,2013,EURO,Approved,"PC,Sony Playstation 3,Xbox 360",Mature 18,STRONG VIOLENCE AND GORE,08/02/2013,"‘Aliens: Colonial Marines’ is a first-person shooter and science-fiction horror game that is based on the “Aliens” franchise. The player takes on the role of a US marine who has been deployed in response to a distress call sent from a space colony. Communication with an earlier team of marines was lost after they had been sent to extract survivors on the space colony. The player’s team of marines has been tasked to search for any remaining survivors, marines and colonists, and to investigate into the events that had transpired during the loss in communication. This game is classified M18 with the consumer advice “Strong Violence and Gore”. In the game, the player will encounter hostile aliens and human enemies. Realistic injuries, such as dismemberments and decapitations, are depicted when enemies are shot at specific parts of the body. Human corpses can also be further dismembered if attacked. Details such as the flesh and the bone can be seen on the dismembered body part. Highly-explosive weapons will cause human enemies to blow up into chunks of flesh and details such as the internal organs are visible. These detailed depictions of violence often occur with realistic blood effects that stain both the environment and the screen. A cut-scene shows an alien bursting out from a woman’s chest. Blood splatters and a detailed puncture wound are depicted when the alien protrudes from her body. In some areas, the player may come across the dismembered body of a humanoid cyborg lying on the floor, where details such as tubes and white patches of fluid identify it as a cyborg. Alien enemies can perform various fatality moves on human characters, which depict the alien stabbing its tongue into a marine’s face or impaling the marine with the sharp end of its tail. These graphic portrayals of violence coupled with realistic blood effects and detailed injuries is appropriate for an M18 rating. According to the M18 guidelines, “depictions of realistic violence such as killing, maiming or causing other serious injury to humanoid characters, if it is not sadistic, cruel or abhorrent” is allowed. Coarse language is used occasionally in the game and includes the use of words such as ‘motherf**ker’ and ‘f**k’. M18 guidelines permit “frequent use of strong coarse language, such as “mother**ker”, “c*nt” and “c**ksucker””."
REMEMBER ME,REMEMBER ME,,CAPCOM,2013,ASIA,Approved,"Sony Playstation 3,Xbox 360",Age Advisory,,29/05/2013,"‘Remember Me’ is an action-adventure game in which the player takes on the role of Nilin, a memory hunter who possesses the ability to extract and alter human memories. Her ability soon attracts the attention of the authorities, who are paranoid that she will use it against the regime. This game is rated with the advisory “Suitable for 16 & Above”. During combat sequences, the player character uses melee moves (e.g. punches and kicks) to battle enemies such as humans and robots. These combat sequences are often stylised with bright lights and do not depict details such as blood or dismemberments. However, during the exploration of various levels in the game, the player may come across human corpses that are strewn on the streets and blood stains on the walls. These environmental elements are non-interactive and do not depict any details. According to the Age Advisory guidelines, “moderate level of violence that is realistic but not excessively graphic may be included in the gameplay”. Coarse language, which includes the use of the word ‘f**k’, is used occasionally by the characters in the game. This is within the Age Advisory guidelines, which allows for “coarse language that is generally limited to the use of words like “f**k”” There are two depictions of female topless nudity, in which details are not portrayed. They include a poster that features a woman with white dots covering her nipples and the concept art of a mutated female human with the left chest exposed. As these depictions do not contain any visible details, they are acceptable under the Age Advisory guidelines which allow for “nudity without details”."
BRAIN AGE: CONCENTRATION TRAINING,BRAIN AGE: CONCENTRATION TRAINING,,NINTENDO OF AMERICA,2013,ASIA,Approved,Nintendo 3DS,General,,14/02/2013,
閃乱カグラ SHINOVI VERSUS 少女達の証明,SENRAN KAGURA SHINOVI VERSUS SHOUJOTACHI NO SHOUMEI,,MARVELOUS AQL,2013,ASIA,Approved,Sony PS Vita,Mature 18,SOME NUDITY,01/03/2013,"‘Senran Kagura Shinovi Versus Shoujotachi no Shoumei’ is an action fighting game where the player can play as several schoolgirls who are ninjas in secret training. The girls do battle against enemies and female Ninjas from other schools. The player has to complete missions in various chapters to progress the storyline. Experience and money is earned through gameplay, allowing the player characters to level up, unlock items and purchase costumes and accessories. This game is rated M18 for some nudity. The protagonists are depicted as voluptuous young girls partaking in the ninja wars. The game features the ""Ninja Turn"" and ""Costume Rip"" systems, which depict the girls in partial nudity during transformation and combat sequences. At the beginning of the stage, the character starts out as a schoolgirl in full uniform, but is able to transform into a ninja to enable more powerful combo moves. During combat, damage received by the player character causes her clothing to rip gradually, revealing the underwear beneath. The clothing can be progressively ripped off with accumulative damage, with only on-screen icons and light strips covering the nipples and genitalia. There is no full nudity in the game, and nipples and genitalia are not depicted. M18 guidelines allow for “Depiction of topless nudity or occasional full frontal nudity, if not exploitative. Nudity should not titillate or be the main feature of the game.”"
DISGAEA D2: A BRIGHTER DARKNESS,DISGAEA D2: A BRIGHTER DARKNESS,,NIPPON ICHI SOFTWARE,2013,"ASIA,US",Approved,Sony Playstation 3,General,,23/08/2013,
PS3 BEST HIT COLLECTION VOL. 1,PS3 BEST HIT COLLECTION VOLUME 1,,SONY COMPUTER ENTERTAINMENT INC,2013,ASIA,Approved,Sony Playstation 3,General,,03/07/2013,
TIME AND ETERNITY,TIME AND ETERNITY,TOKI TO EIEN ~TOKI TOWA~,NIS,2013,"ASIA,EURO,US",Approved,Sony Playstation 3,Age Advisory,,04/07/2013,"‘Time and Eternity’ is a role-playing game that revolves around a couple, Zack and his bride, Toki, whose wedding comes to an abrupt end when they are attacked on the day of the ceremony. The attack led to Zack’s death but Toki was able to bring the couple back in time into the past to prevent the tragedy from occurring. As they embark on their journey to solve the mystery behind the attack, Zack learns of the presence of an alter-ego, Towa, who resides in the same body as Toki. Together, the trio tries to overcome a time paradox that is preventing the marriage from taking place. This game is rated with the advisory “Suitable for 16 & Above”. Over the course of the game, the player will be rewarded with still-images of female characters who are dressed in revealing clothing. These images also depict females posing in compromising positions that expose their undergarment. Another image shows a female character dressed in a wet shirt that reveals her cleavage and a partial view of the crotch. According to the classification guidelines, “still or moving images which may be mildly suggestive” is allowed at the Age Advisory rating. In one of the quests, the player character will attempt to peek at female characters in the showers. The quest then requires the player to obtain skills and objects to clear away the steam that is obscuring the view. After completing a series of side-quests, a scene of a topless female character with hair covering her breasts will be shown. While details such as the nipples are not depicted, the outlines of the breasts are clearly visible. Under the Age Advisory guidelines, “nudity without details such as nipples, genitalia or pubic region” can be allowed."
MARCH OF THE EAGLES,MARCH OF THE EAGLES,,PARADOX,2013,EURO,Approved,PC,General,,16/05/2013,
GRID 2,GRID 2,,CODEMASTERS,2013,EURO,Approved,"PC,Sony Playstation 3,Xbox 360",General,,16/05/2013,
PUZZLE CHRONICLES,PUZZLE CHRONICLES,,KONAMI,2010,US,Approved,Sony Playstation Portable (PSP),General,,26/07/2013,
THE SIMS 3 INTO THE FUTURE,THE SIMS 3 INTO THE FUTURE,,ELECTRONIC ARTS,2013,ASIA,Approved,"Macintosh,PC",General,,29/08/2013,
DRAGON'S CROWN,DRAGON'S CROWN,ドラゴンズクラウン,ATLUS / INDEX CORPORATION,2013,"ASIA,US",Approved,"Sony Playstation 3,Sony PS Vita",Age Advisory,,09/07/2013,"‘Dragon’s Crown’ is a side-scrolling action role-playing game set in a medieval fantasy world where a group of adventurers try to prevent the Dragon’s Crown, a magical treasure, from falling into the wrong hands. The player can choose any of 6 characters as the main protagonist. Each character has its own specific class with unique weapons, attacks and powers. While exploring ruins and dungeons across various environments, the player can collect skeletal remains of fallen warriors and revive them as companions on quests. Weapons and accessories can also be collected on these expeditions to customise the character’s arsenal and combat statistics. The game is rated with the advisory “Suitable for 16 & Above”. The player character and up to 3 combat support characters can embark on a variety of quests. The player can select from various character classes such as wizards, fighters, elves, dwarves and Amazon warriors. Combat occurs frequently against fantasy creatures such as minotaurs, harpies, wyverns, bats and giant spiders. Some blood splattering occurs when characters take damage in combat, but no injury details are depicted. Several female characters and enemy creatures are depicted in suggestive outfits that reveal cleavage, and have voluptuous body proportions with large breasts. Two of these females are playable characters and their breasts shake and bounce about exaggeratedly during any character movement. A mermaid character appears topless, with only her hair covering her nipples. The guidelines for Age Advisory permit “Nudity without details”, and state that “Still or moving images which may be mildly suggestive may be featured, e.g. scantily-clad women in bikinis or lingerie”."
XBLAZE CODE: EMBRYO,XBLAZE CODE: EMBRYO,,ARC SYSTEM WORKS CO LTD.,2013,ASIA,Approved,"Sony Playstation 3,Sony PS Vita",Age Advisory,,22/07/2013,"‘XBlaze Code: Embryo’ is a visual novel that revolves around a student named Toya Kagari. Numerous reports have surfaced about mysterious deaths that have occurred in the city that Kagari is living in. After his escape from an attack by a raging man, Kagari meets a sword-wielding girl who later becomes his guardian. Spurred by his curiosity to uncover the truth behind the attack, Kagari, together with his new-found ally, begins investigating into the strange happenings within the city. The game is classified with the advisory ‘Suitable for 16 & Above’. The level of violence in the game is mild as instances of violence are implied through still-images that are presented on the screen; along with sound effects and dialogue text. Some details such as blood stains and ripped clothing can be seen but these are not realistic or graphic in nature. Several female characters in the game possess voluptuous figures and are occasionally depicted in swim suits or topless. While a lot of cleavage is exposed, details such as the nipples are not depicted. For example, in one still-image, a pair of topless female characters is seen taking a bath together but only the outlines of their breasts are visible. Under the classification guidelines for Age Advisory, “nudity without details including still or moving images which may be mildly suggestive may be featured, e.g. scantily-clad women in bikinis or lingerie”."
HAKUOKI: WARRIORS OF THE SHINSENGUMI,HAKUOKI: WARRIORS OF THE SHINSENGUMI,,AKSYS GAMES,2013,US,Approved,Sony Playstation Portable (PSP),Age Advisory,,21/02/2013,"‘Hakuoki: Warriors Of The Shinsengumi’ is an action adventure game set in 19th century Japan where the player controls Samurai warriors to play through several story scenarios. The player has to eliminate waves of enemies and boss characters in combat to complete the level and progress. This game is given the advisory “Suitable for 16 & Above”. While the game’s dialogue is dubbed in Japanese, there are scenes where coarse language such as ‘f**k’ and its variations can be seen in the English subtitles. The guidelines for Age Advisory state that “Coarse language should generally be limited to the use of words like f**k”. The level of violence during combat is considered mild, without any blood or gore. However, several of the cinematic anime scenes depict blood, violence and some gore, including an un-detailed scene of decapitation where the silhouette of the victim’s body and severed head can be seen. Another scene also shows a bloodied hand with severed fingers. The Age Advisory guidelines permit a ‘moderate level of violence’, which refers to realistic but not excessively graphic violence with depiction of blood which may be included in the gameplay."
MAJOR LEAGUE BASEBALL 2K13,MAJOR LEAGUE BASEBALL 2K13,,TAKE 2/2K SPORTS/VISUAL CONCEPT,2013,ASIA,Approved,"Sony Playstation 3,Xbox 360",General,,06/02/2013,
GOD OF WAR: ASCENSION,GOD OF WAR: ASCENSION,,SONY COMPUTER ENTERTAINMENT INC.,2013,ASIA,Approved,Sony Playstation 3,Mature 18,STRONG VIOLENCE AND NUDITY,26/02/2013,"‘God of War: Ascension’ is a third-person, action-adventure game and details the story of Kratos, a demi-god destined to destroy the gods of Olympus. Realising that he had been tricked by Ares into killing his own wife and child, Kratos breaks the blood oath between him and the god, leading to his imprisonment and daily torture by the Furies. Despite the ordeals, Kratos manages to free himself and seeks redemption for the sins that he had committed and to ensure that the blood oath is forever broken. This game is classified M18 with the consumer advice “Strong Violence and Nudity”. During combat, the player character will battle mythical creatures and human enemies. Dismemberments and disembowelments are depicted when the player uses a special attack to finish off the enemy. During such an attack, the player character is also seen stabbing at an enemy repeatedly to finish it off. These instances of graphic violence are often highlighted by realistic blood sprays and blood stains that appear on nearby surfaces. Some cut-scenes also depict violence and gore, where human characters are impaled and strangulated by the player character. These depictions of realistic violence are within the M18 guidelines, where “depictions of realistic violence such as killing, maiming or causing other serious injury to humanoid characters, if it is not sadistic, cruel or abhorrent” is allowed. A cut-scene depicts the player character’s encounter with several topless women, whose bare breasts can be seen, including details such as the nipples. These women are later seen frolicking around the main character and making sexually-suggestive advances at him but no sexual act is depicted. Some enemies are also depicted with topless nudity where nipples are visible. Under the M18 guidelines for nudity, “non-exploitative depiction of topless nudity or occasional full frontal nudity” can be allowed but “should not titillate or be the main feature of the game”."
